{
  "accepted_feedback_ids": [
    "fb_001",
    "fb_002",
    "fb_003"
  ],
  "created_conflict_ids": [],
  "declined_feedback": [],
  "draft_after_content": "# Toy Approval Adapter Spec\n\n## Purpose\n\nDefine a tiny approval adapter contract for smoke testing Whetstone.\n\n## Interface\n\nThe adapter MUST expose an HTTP JSON endpoint:\n\n- Method: `POST`\n- Path: `/v1/approval`\n- Content-Type: `application/json`\n\nSynchronous: the adapter returns a response in the same HTTP call.\n\n## Request\n\nJSON body:\n\n- `request_id` (string, required): caller-provided stable identifier.\n- `decision` (string, required): one of the allowed values below.\n- `expires_at` (string, required): RFC 3339 timestamp in UTC (`Z`), e.g. `2026-05-02T12:34:56Z`.\n\n### Allowed `decision` values\n\n- `approve`\n- `reject`\n\n`decision` validation is case-sensitive; any other value is invalid.\n\n## Response\n\n### Success\n\nIf the request is accepted, respond:\n\n- Status: `200`\n- JSON body:\n  - `request_id` (string): echoes the request.\n  - `decision` (string): echoes the normalized decision (exactly `approve` or `reject`).\n  - `submitted_at` (string): RFC 3339 timestamp in UTC (`Z`), generated by the adapter at acceptance time.\n\n### Error\n\nIf validation fails, the adapter MUST reject the request:\n\n- Status: `400`\n- JSON body:\n  - `error` (object):\n    - `code` (string): one of:\n      - `invalid_decision`\n      - `invalid_expires_at`\n      - `expired_request`\n      - `missing_field`\n    - `message` (string): human-readable.\n\n## Validation\n\n- Missing required fields: reject with `400` and `error.code=missing_field`.\n- Invalid decisions: reject with `400` and `error.code=invalid_decision`.\n- `expires_at` parsing: must be RFC 3339 with UTC `Z`; otherwise reject with `400` and `error.code=invalid_expires_at`.\n- Expiration: if the adapter's current UTC time is greater than or equal to `expires_at`, reject with `400` and `error.code=expired_request`.\n",
  "draft_after_hash": "507a0de2750d9f285d8a609493be19ba29e49c49789ac283f5a4f2b4dc2c5009",
  "draft_before_hash": "f815401766c93c3cca3b3db4779bd43f06d7ebc2c28782b5f9004beec64e70b2",
  "modified_feedback_ids": [],
  "resolved_issue_ids": [
    "iss_0390370a3c5775f3",
    "iss_7039c5b2cf2fa736",
    "iss_db1c1e71d548e958"
  ],
  "round_number": 1,
  "unresolved_issue_ids": []
}
