{
  "accepted_feedback_ids": [],
  "created_conflict_ids": [],
  "declined_feedback": [],
  "draft_after_content": null,
  "draft_after_hash": "7c2619ab4cfd5f5d38e5536fecc207586b29267b8c7b40f2203d9559a27ca081",
  "draft_before_hash": "7c2619ab4cfd5f5d38e5536fecc207586b29267b8c7b40f2203d9559a27ca081",
  "modified_feedback_ids": [],
  "resolved_issue_ids": [],
  "round_number": 4,
  "unresolved_issue_ids": []
}
