{
  "accepted_feedback_ids": [],
  "created_conflict_ids": [],
  "declined_feedback": [],
  "draft_after_content": "# Toy Notification Spec\n\n## Purpose\n\nSend a notification when a watched file changes.\n\n## Roles\n\n- Watcher: observes file changes.\n- Sender: sends notifications.\n- Operator: configures the watched file and destination.\n\n## Behavior\n\nThe system checks `watch_path` every `poll_interval_seconds`.\n\n### Change Detection\n\nA file is considered \"changed\" at a poll interval if the SHA-256 hash of the file byte contents differs from the SHA-256 hash recorded at the previous successful read.\n\n### Startup Behavior\n\nOn startup, the system attempts to read `watch_path`.\n\n- If the read succeeds, the system records the SHA-256 hash as the baseline and MUST NOT send a notification.\n- If the read fails, the system records the failure (see Failure Handling), does not establish a baseline, and continues polling.\n\n### Notification\n\nAt each poll interval after a baseline is established:\n\n- If the current SHA-256 hash equals the baseline, the system does nothing.\n- If the current SHA-256 hash differs from the baseline, the system attempts to send a notification to `destination` and:\n  - on success, updates the baseline to the current hash\n  - on failure, records the failure and MUST NOT update the baseline\n\n## Configuration\n\n```yaml\nwatch_path: ./input.txt\ndestination: ops@example.com\npoll_interval_seconds: 60\nfailure_log_path: ./failure.log\nevent_log_path: ./event.log\n```\n\n## Operational Observability\n\nThe system MUST provide success-path observability and a liveness signal by writing newline-delimited JSON (NDJSON) records to `event_log_path`.\n\n### Event Records\n\nEach event record MUST include:\n\n- `timestamp`: ISO 8601 combined date-time in UTC formatted as `YYYY-MM-DDTHH:MM:SS.sssZ` (millisecond precision, `Z` suffix)\n- `watch_path`: the configured watch path\n- `destination`: the configured destination\n- `event`: one of `startup_baseline_established`, `poll`, or `notification_sent`\n\nAdditional required fields by `event`:\n\n- `startup_baseline_established`:\n  - `baseline_hash`: the SHA-256 hash recorded as the baseline\n- `poll`:\n  - `outcome`: one of `no_baseline`, `read_failed`, `no_change`, or `change_detected`\n  - `baseline_established`: boolean\n  - `baseline_hash`: the current baseline hash when `baseline_established` is true\n  - `current_hash`: the computed hash when the read succeeds\n- `notification_sent`:\n  - `previous_baseline_hash`: the baseline hash before sending\n  - `new_baseline_hash`: the hash that becomes the new baseline after sending\n\n### Liveness\n\nAfter startup, at each poll interval, the system MUST append exactly one `poll` event record.\n\n## Failure Handling\n\n### Failure Log Destination\n\nThe system records failures by appending a newline-delimited JSON (NDJSON) record to the file at `failure_log_path` (default `./failure.log`).\n\n### Failure Records\n\nEach failure record MUST include:\n\n- `timestamp`: ISO 8601 combined date-time in UTC formatted as `YYYY-MM-DDTHH:MM:SS.sssZ` (millisecond precision, `Z` suffix)\n- `watch_path`: the configured watch path\n- `destination`: the configured destination\n- `phase`: one of `read` or `send`\n- `error`: a human-readable error string\n\nIf reading `watch_path` fails at startup or at any poll interval, the system records a failure with `phase: read` and continues polling.\n\nIf sending fails, the system records a failure with `phase: send` and continues polling.\n\n### Log Write Failures\n\nIf appending a failure record to `failure_log_path` fails, the system MUST emit the same JSON record to stderr and MUST continue polling.\n\nIf appending an event record to `event_log_path` fails, the system MUST emit the same JSON record to stderr and MUST continue polling.\n\n### Retention and Rotation\n\nLog retention and rotation for `failure_log_path` and `event_log_path` are the operator responsibility (for example via `logrotate` or a platform logging agent). The system MUST tolerate the log files being rotated, truncated, or replaced between writes.\n",
  "draft_after_hash": "1366ad7fe376ac039da7f008d085130f295ebb09f5642ef844f0a21b20c6acea",
  "draft_before_hash": "7151f72eeb25b8e9200041ca7d61e96d6a35898df946f75c607799ba6271617b",
  "modified_feedback_ids": [
    "fb_op_r3_001",
    "fb_op_r3_002",
    "fb_op_r3_003",
    "fb_op_r3_004",
    "fb_op_r3_005"
  ],
  "resolved_issue_ids": [
    "iss_a1b2c3d4e5f60718",
    "iss_b2c3d4e5f6071819",
    "iss_c3d4e5f607181920",
    "iss_d4e5f60718192021",
    "iss_e5f6071819202122"
  ],
  "round_number": 3,
  "unresolved_issue_ids": []
}
